{
  "schema_version": "pywel.evidence.v1",
  "evidence_id": "evd_01jzcdpatch109official001",
  "evidence_type": "official_patch",
  "source": {
    "url": "https://crimsondesert.pearlabyss.com/en-US/News/Notice/Detail?_boardNo=94&pubDate=20260612",
    "title": "Patch Notes Version 1.09.00",
    "publisher": "Pearl Abyss",
    "published_at": "2026-05-29T06:20:00Z",
    "locator": "New Additions; Controls"
  },
  "captured_at": "2026-07-14T00:00:00-05:00",
  "rights": {
    "retention_mode": "normalized_facts",
    "license_status": "publisher_owned",
    "attribution_required": true
  },
  "reliability": {
    "tier": "primary_official",
    "independence_group": "pearl-abyss-patch-1.09.00"
  },
  "provenance": {
    "created_at": "2026-07-14T00:00:00-05:00",
    "created_by": "seed_import_v1",
    "source_receipt_id": "rcp_m1publicscope202609100001"
  }
}
